## DISABLE_FAST_SQL_PARSER
#error ER_PARSE_ERROR
## error_msg: $# ERR_PARSER #$
CREATE TABLE t1(f1 int CHECK);
ERR_PARSER
#error ER_PARSE_ERROR
## error_msg: $# ERR_PARSER #$
CREATE TABLE t1(f1 int CHECK());
ERR_PARSER
#error ER_PARSE_ERROR
## error_msg: $# ERR_PARSER #$
CREATE TABLE t1(f1 int CONSTRAINT CHECK());
ERR_PARSER
#error ER_PARSE_ERROR
## error_msg: $# ERR_PARSER #$
CREATE TABLE t1(f1 int t1_ck CHECK());
ERR_PARSER
#error ER_PARSE_ERROR
## error_msg: $# ERR_PARSER #$
CREATE TABLE t1(f1 int CONSTRAINT t1_ck CHECK());
ERR_PARSER
#error ER_PARSE_ERROR
## error_msg: $# ERR_PARSER #$
CREATE TABLE t1(f1 int CONSTRAINT t1_ck CHECK( f1 < 10) NOT);
ERR_PARSER
#error ER_NON_BOOLEAN_EXPR_FOR_CHECK_CONSTRAINT
## error_msg: $# ERR_SERVER #$
CREATE TABLE t1(f1 int CHECK(f1));
ERR_SERVER
#error ER_NON_BOOLEAN_EXPR_FOR_CHECK_CONSTRAINT
## error_msg: $# ERR_SERVER #$
CREATE TABLE t1(f1 int CHECK(f1 + 10));
ERR_SERVER
#error ER_COLUMN_CHECK_CONSTRAINT_REFERENCES_OTHER_COLUMN
## error_msg: $# ERR_SERVER #$
CREATE TABLE t1(f1 int CHECK(f2 < 10));
ERR_SERVER
CREATE TABLE t1 (f1 int CHECK(f1 < 10),
f2 int CONSTRAINT t1_f2_ck CHECK (f2 < 10));
SHOW CREATE TABLE t1;
Table,Create Table
t1,CREATE TABLE `t1` (
	`f1` int DEFAULT NULL,
	`f2` int DEFAULT NULL,
	CONSTRAINT `t1_chk_1` CHECK (`f1` < 10),
	CONSTRAINT `t1_f2_ck` CHECK (`f2` < 10)
) ENGINE = InnoDB DEFAULT CHARSET = utf8mb4
DROP TABLE t1;
#error ER_PARSE_ERROR
## error_msg: $# ERR_PARSER #$
CREATE TABLE t1(f1 int CHECK(f1 < 10), f2 int CHECK);
ERR_PARSER
#error ER_PARSE_ERROR
## error_msg: $# ERR_PARSER #$
CREATE TABLE t1(f1 int CHECK(f1 < 10), f2 int CHECK());
ERR_PARSER
#error ER_PARSE_ERROR
## error_msg: $# ERR_PARSER #$
CREATE TABLE t1(f1 int CHECK(f1 < 10), f2 int CONSTRAINT CHECK());
ERR_PARSER
#error ER_PARSE_ERROR
## error_msg: $# ERR_PARSER #$
CREATE TABLE t1(f1 int CHECK(f1 < 10), f2 int t1_f2_ck CHECK(f2 < 10));
ERR_PARSER
#error ER_PARSE_ERROR
## error_msg: $# ERR_PARSER #$
CREATE TABLE t1(f1 int CHECK(f1 < 10), f2 int CONSTRAINT t1_f2_ck CHECK(f2 < 10) NOT);
ERR_PARSER
#error ER_PARSE_ERROR
## error_msg: $# ERR_PARSER #$
CREATE TABLE t1(f1 int CHECK(f1 < 10), f2 int CHECK(f2 < 10) NOT);
ERR_PARSER
#error ER_NON_BOOLEAN_EXPR_FOR_CHECK_CONSTRAINT
## error_msg: $# ERR_SERVER #$
CREATE TABLE t1(f1 int CHECK(f1 < 10), f2 int CHECK(f2));
ERR_SERVER
#error ER_NON_BOOLEAN_EXPR_FOR_CHECK_CONSTRAINT
## error_msg: $# ERR_SERVER #$
CREATE TABLE t1(f1 int CHECK(f1 < 10), f2 int CHECK(f2 + 10));
ERR_SERVER
#error ER_COLUMN_CHECK_CONSTRAINT_REFERENCES_OTHER_COLUMN
## error_msg: $# ERR_SERVER #$
CREATE TABLE t1(f1 int CHECK(f1 < 10), f2 int CHECK(f3 < 10));
ERR_SERVER
CREATE TABLE t1 (f1 int CHECK(f1 < 10), f2 int CHECK(f2 < 10),
f3 int CONSTRAINT t1_f3_ck CHECK (f3  < 10));
SHOW CREATE TABLE t1;
Table,Create Table
t1,CREATE TABLE `t1` (
	`f1` int DEFAULT NULL,
	`f2` int DEFAULT NULL,
	`f3` int DEFAULT NULL,
	CONSTRAINT `t1_chk_1` CHECK (`f1` < 10),
	CONSTRAINT `t1_chk_2` CHECK (`f2` < 10),
	CONSTRAINT `t1_f3_ck` CHECK (`f3` < 10)
) ENGINE = InnoDB DEFAULT CHARSET = utf8mb4
DROP TABLE t1;
# Test cases to verify table check constraint syntax.
#error ER_PARSE_ERROR
## error_msg: $# ERR_PARSER #$
CREATE TABLE t1(f1 int, CONSTRAINT t1_ck CHECK);
ERR_PARSER
#error ER_PARSE_ERROR
## error_msg: $# ERR_PARSER #$
CREATE TABLE t1(f1 int, CONSTRAINT t1_ck CHECK();
ERR_PARSER
#error ER_PARSE_ERROR
## error_msg: $# ERR_PARSER #$
CREATE TABLE t1(f1 int, CONSTRAINT t1_ck CHECK());
ERR_PARSER
#error ER_NON_BOOLEAN_EXPR_FOR_CHECK_CONSTRAINT
## error_msg: $# ERR_SERVER #$
CREATE TABLE t1(f1 int, CONSTRAINT t1_ck CHECK(f1));
ERR_SERVER
#error ER_NON_BOOLEAN_EXPR_FOR_CHECK_CONSTRAINT
## error_msg: $# ERR_SERVER #$
CREATE TABLE t1(f1 int, CONSTRAINT t1_ck CHECK(f1 + 10));
ERR_SERVER
#error ER_CHECK_CONSTRAINT_REFERS_UNKNOWN_COLUMN
## error_msg: $# ERR_SERVER #$
CREATE TABLE t1(f1 int, CONSTRAINT t1_ck CHECK(f2 < 10));
ERR_SERVER
CREATE TABLE t1(f1 int, CONSTRAINT t1_ck CHECK(f1 < 10));
SHOW CREATE TABLE t1;
Table,Create Table
t1,CREATE TABLE `t1` (
	`f1` int DEFAULT NULL,
	CONSTRAINT `t1_ck` CHECK (`f1` < 10)
) ENGINE = InnoDB DEFAULT CHARSET = utf8mb4
DROP TABLE t1;
#error ER_PARSE_ERROR
## error_msg: $# ERR_PARSER #$
CREATE TABLE t1(f1 int, CONSTRAINT t1_ck CHECK(f1<10), CONSTRAINT t2_ck CHECK);
ERR_PARSER
#error ER_PARSE_ERROR
## error_msg: $# ERR_PARSER #$
CREATE TABLE t1(f1 int, CONSTRAINT t1_ck CHECK(f1<10), CONSTRAINT t2_ck CHECK();
ERR_PARSER
#error ER_PARSE_ERROR
## error_msg: $# ERR_PARSER #$
CREATE TABLE t1(f1 int, CONSTRAINT t1_ck CHECK(f1<10), CONSTRAINT t2_ck CHECK(f2 > 0) NOT);
ERR_PARSER
#error ER_NON_BOOLEAN_EXPR_FOR_CHECK_CONSTRAINT
## error_msg: $# ERR_SERVER #$
 CREATE TABLE t1(f1 int, CONSTRAINT t1_ck CHECK(f1<10), CONSTRAINT t2_ck CHECK(f1));
ERR_SERVER
#error ER_NON_BOOLEAN_EXPR_FOR_CHECK_CONSTRAINT
## error_msg: $# ERR_SERVER #$
 CREATE TABLE t1(f1 int, CONSTRAINT t1_ck CHECK(f1<10), CONSTRAINT t2_ck CHECK(f1 + 10));
ERR_SERVER
#error ER_CHECK_CONSTRAINT_REFERS_UNKNOWN_COLUMN
## error_msg: $# ERR_SERVER #$
 CREATE TABLE t1(f1 int, CONSTRAINT t1_ck CHECK(f1<10), CONSTRAINT t2_ck CHECK(f2 > 1));
ERR_SERVER
# Check constraint with specified and generated name.
CREATE TABLE t1(f1 int, CHECK(f1<10), CONSTRAINT t2_ck CHECK(f1 > 1));
SHOW CREATE TABLE t1;
Table,Create Table
t1,CREATE TABLE `t1` (
	`f1` int DEFAULT NULL,
	CONSTRAINT `t1_chk_1` CHECK (`f1` < 10),
	CONSTRAINT `t2_ck` CHECK (`f1` > 1)
) ENGINE = InnoDB DEFAULT CHARSET = utf8mb4
DROP TABLE t1;
# Test case to verify check constraint name with special charecters.
CREATE TABLE t1(c1 INT, c2 INT, CONSTRAINT `ck_1$` CHECK (c2 < 10));
SHOW CREATE TABLE t1;
Table,Create Table
t1,CREATE TABLE `t1` (
	`c1` int DEFAULT NULL,
	`c2` int DEFAULT NULL,
	CONSTRAINT `ck_1$` CHECK (`c2` < 10)
) ENGINE = InnoDB DEFAULT CHARSET = utf8mb4
DROP TABLE t1;
# Test case to verify check constraint name with white spaces.
CREATE TABLE t1(c1 INT, c2 INT, CONSTRAINT ` ck_2$ ` CHECK (c2 < 10));
SHOW CREATE TABLE t1;
Table,Create Table
t1,CREATE TABLE `t1` (
	`c1` int DEFAULT NULL,
	`c2` int DEFAULT NULL,
	CONSTRAINT ` ck_2$ ` CHECK (`c2` < 10)
) ENGINE = InnoDB DEFAULT CHARSET = utf8mb4
#error ER_CHECK_CONSTRAINT_NOT_FOUND
## error_msg: $# ERR_DROP_CHECK_CONSTRAINT #$
ALTER TABLE t1 DROP CHECK ck_2$;
ERR_DROP_CHECK_CONSTRAINT
ALTER TABLE t1 DROP CHECK ` ck_2$ `;
SHOW CREATE TABLE t1;
Table,Create Table
t1,CREATE TABLE `t1` (
	`c1` int DEFAULT NULL,
	`c2` int DEFAULT NULL
) ENGINE = InnoDB DEFAULT CHARSET = utf8mb4
ALTER TABLE t1 ADD COLUMN c3 INTEGER , ADD CONSTRAINT ` c 3 ` CHECK ( c3 > 10 );
SHOW CREATE TABLE t1;
Table,Create Table
t1,CREATE TABLE `t1` (
	`c1` int DEFAULT NULL,
	`c2` int DEFAULT NULL,
	`c3` int DEFAULT NULL,
	CONSTRAINT ` c 3 ` CHECK (`c3` > 10)
) ENGINE = InnoDB DEFAULT CHARSET = utf8mb4
DROP TABLE t1;
# Test case to verify check constraint with long name.
CREATE TABLE t1(c1 INT, c2 INT,
CONSTRAINT ckkkkkkkkkkkkkkkkkkkkkkkkkkkkkkkkkkkkkkkkkkkkkkkkkkkk
CHECK (c2 < 10));
SHOW CREATE TABLE t1;
Table,Create Table
t1,CREATE TABLE `t1` (
	`c1` int DEFAULT NULL,
	`c2` int DEFAULT NULL,
	CONSTRAINT `ckkkkkkkkkkkkkkkkkkkkkkkkkkkkkkkkkkkkkkkkkkkkkkkkkkkk` CHECK (`c2` < 10)
) ENGINE = InnoDB DEFAULT CHARSET = utf8mb4
#error ER_CHECK_CONSTRAINT_NOT_FOUND
## error_msg: $# is too long #$
CREATE TABLE t2(c1 INT, c2 INT,
CONSTRAINT ckkkkkkkkkkkkkkkkkkkkkkkkkkkkkkkkkkkkkkkkkkkkkkkkkkkk1
CHECK (c2 < 10));
is too long
DROP TABLE t1;
# Test case to verify check constraint with too long generated name.
CREATE TABLE t1 (f1 INT CHECK (f1 < 10));
RENAME TABLE t1 TO t12345678901234567890123456789012345678901234567;
DROP TABLE t12345678901234567890123456789012345678901234567;
#error ER_CHECK_CONSTRAINT_NOT_FOUND
## error_msg: $# is too long #$
CREATE TABLE t12345678901234567890123456789012345678901234567(f1 INT CHECK(f1 < 10));
is too long
CREATE TABLE t12345678901234567890123456789012345678901234567(f1 INT);
#error ER_CHECK_CONSTRAINT_NOT_FOUND
## error_msg: $# is too long #$
ALTER TABLE t12345678901234567890123456789012345678901234567 ADD CONSTRAINT CHECK (f1 < 10);
is too long
DROP TABLE t12345678901234567890123456789012345678901234567;
# Test case to verify duplicate check constraint name under same
 # database. Check constraints with same name are not allowed under
 # same table.
CREATE TABLE t1(c1 INT CHECK (c1 > 10), CONSTRAINT ck CHECK(c1 > 10));
#error ER_CHECK_CONSTRAINT_NOT_FOUND
 ## error_msg: $# ERR_ADD_CHECK_CONSTRAINT #$
ALTER TABLE t1 ADD CONSTRAINT ck CHECK(c1 > 10);
ERR_ADD_CHECK_CONSTRAINT
DROP TABLE t1;
# Check constraint names are case insenitive and accent sensitive. Test
 # case to verify the same.
#error ER_CHECK_CONSTRAINT_NOT_FOUND
## error_msg: $# ERR_SERVER #$
CREATE TABLE t1 (f1 INT,
CONSTRAINT cafe CHECK (f1 < 10),
CONSTRAINT CAFE CHECK (f1 < 10));
ERR_SERVER
# Test cases to verify forward reference of columns in the constraint.
#error ER_CHECK_CONSTRAINT_NOT_FOUND
## error_msg: $# ERR_SERVER #$
CREATE TABLE t1(CHECK((f1 + f3) > 10), f1 int CHECK (f1 < 10), f2 int);
ERR_SERVER
CREATE TABLE t1(CHECK((f1 + f2) > 10), f1 int CHECK (f1 < 10), f2 int);
SHOW CREATE TABLE t1;
Table,Create Table
t1,CREATE TABLE `t1` (
	`f1` int DEFAULT NULL,
	`f2` int DEFAULT NULL,
	CONSTRAINT `t1_chk_1` CHECK (`f1` + `f2` > 10),
	CONSTRAINT `t1_chk_2` CHECK (`f1` < 10)
) ENGINE = InnoDB DEFAULT CHARSET = utf8mb4
#SELECT * FROM INFORMATION_SCHEMA.CHECK_CONSTRAINTS;
DROP TABLE t1;
# Test case to verify creation of multiple check constraint on table.
CREATE TABLE t1(c1 INT, c2 INT, c3 INT, c4 INT);
ALTER TABLE t1 ADD CONSTRAINT ck11 CHECK(c1 > 1),
ADD CONSTRAINT ck12 CHECK(c1 < 1),
ADD CONSTRAINT ck21 CHECK(c2 > 1),
ADD CONSTRAINT ck22 CHECK(c2 < 1),
ADD CONSTRAINT ck31 CHECK(c3 > 1),
ADD CONSTRAINT ck32 CHECK(c3 < 1),
ADD CONSTRAINT ck41 CHECK(c4 > 1),
ADD CONSTRAINT ck42 CHECK(c4 < 1);
SHOW CREATE TABLE t1;
Table,Create Table
t1,CREATE TABLE `t1` (
	`c1` int DEFAULT NULL,
	`c2` int DEFAULT NULL,
	`c3` int DEFAULT NULL,
	`c4` int DEFAULT NULL,
	CONSTRAINT `ck11` CHECK (`c1` > 1),
	CONSTRAINT `ck12` CHECK (`c1` < 1),
	CONSTRAINT `ck21` CHECK (`c2` > 1),
	CONSTRAINT `ck22` CHECK (`c2` < 1),
	CONSTRAINT `ck31` CHECK (`c3` > 1),
	CONSTRAINT `ck32` CHECK (`c3` < 1),
	CONSTRAINT `ck41` CHECK (`c4` > 1),
	CONSTRAINT `ck42` CHECK (`c4` < 1)
) ENGINE = InnoDB DEFAULT CHARSET = utf8mb4
DROP TABLE t1;
# Test case to verify check constraints with generated columns
CREATE TABLE t1(c1 INT,
c2 INT,
c3 INT GENERATED ALWAYS AS (c1 + c2),
CONSTRAINT ck CHECK (c3 > 10)
);
SHOW CREATE TABLE t1;
Table,Create Table
t1,CREATE TABLE `t1` (
	`c1` int DEFAULT NULL,
	`c2` int DEFAULT NULL,
	`c3` int GENERATED ALWAYS AS (`c1` + `c2`) VIRTUAL,
	CONSTRAINT `ck` CHECK (`c3` > 10)
) ENGINE = InnoDB DEFAULT CHARSET = utf8mb4
#error ER_CHECK_CONSTRAINT_NOT_FOUND
## error_msg: $# ERR_EXECUTE_ON_MYSQL #$
INSERT INTO t1(c1,c2) VALUES(1,1);
ERR_EXECUTE_ON_MYSQL
INSERT INTO t1(c1,c2) VALUES(10,10);
DROP TABLE t1;
# Test case to verify check constraints with DEFAULT column value.
CREATE TABLE t1(c1 INT DEFAULT 100 CHECK(c1 > 10));
#error ER_CHECK_CONSTRAINT_NOT_FOUND
## error_msg: $# ERR_EXECUTE_ON_MYSQL #$
INSERT INTO t1() VALUES(1);
ERR_EXECUTE_ON_MYSQL
INSERT INTO t1() VALUES();
DROP TABLE t1;
CREATE TABLE t1(c1 int DEFAULT 1, CONSTRAINT CHECK(c1 IS NOT NULL));
INSERT INTO t1() VALUES();
#error ER_CHECK_CONSTRAINT_NOT_FOUND
## error_msg: $# ERR_EXECUTE_ON_MYSQL #$
INSERT INTO t1() VALUES(NULL);
ERR_EXECUTE_ON_MYSQL
DROP TABLE t1;
# Test case to verify check constraint behaviour with ascii charset
CREATE TABLE t1(c1 VARCHAR(1) CHARSET ASCII CHECK(c1 = 'a'),
c2 VARCHAR(1) CHARSET ASCII DEFAULT('b'));
SHOW CREATE TABLE t1;
Table,Create Table
t1,CREATE TABLE `t1` (
	`c1` varchar(1) CHARACTER SET ascii COLLATE ascii_general_ci DEFAULT NULL,
	`c2` varchar(1) CHARACTER SET ascii COLLATE ascii_general_ci DEFAULT (_utf8mb4 'b'),
	CONSTRAINT `t1_chk_1` CHECK (`c1` = _utf8mb4 'a')
) ENGINE = InnoDB DEFAULT CHARSET = utf8mb4
#error ER_CHECK_CONSTRAINT_NOT_FOUND
## error_msg: $# ERR_EXECUTE_ON_MYSQL #$
INSERT INTO t1(c1) VALUES('b');
ERR_EXECUTE_ON_MYSQL
INSERT INTO t1(c1) VALUES('a');
DROP TABLE t1;
# Test case to verify check constraint with an expression evaluated to FALSE always.
CREATE TABLE t1 (CHECK (1 < 1), f1 int);
SHOW CREATE TABLE t1;
Table,Create Table
t1,CREATE TABLE `t1` (
	`f1` int DEFAULT NULL,
	CONSTRAINT `t1_chk_1` CHECK (1 < 1)
) ENGINE = InnoDB DEFAULT CHARSET = utf8mb4
#error ER_CHECK_CONSTRAINT_NOT_FOUND
## error_msg: $# ERR_EXECUTE_ON_MYSQL #$
INSERT INTO t1 VALUES(1);
ERR_EXECUTE_ON_MYSQL
#error ER_CHECK_CONSTRAINT_NOT_FOUND
## error_msg: $# ERR_EXECUTE_ON_MYSQL #$
INSERT INTO t1 VALUES(10);
ERR_EXECUTE_ON_MYSQL
#error ER_CHECK_CONSTRAINT_NOT_FOUND
## error_msg: $# ERR_EXECUTE_ON_MYSQL #$
INSERT INTO t1 VALUES();
ERR_EXECUTE_ON_MYSQL
DROP TABLE t1;
# Test cases to verify check constraints with CREATE TABLE LIKE
CREATE TABLE t1(f1 INT CHECK (f1 < 10), f2 INT, CHECK (f2 < 10),
CONSTRAINT min CHECK (f1 + f2 > 10),
CONSTRAINT max CHECK (f1 + f2 < 929));
SHOW CREATE TABLE t1;
Table,Create Table
t1,CREATE TABLE `t1` (
	`f1` int DEFAULT NULL,
	`f2` int DEFAULT NULL,
	CONSTRAINT `max` CHECK (`f1` + `f2` < 929),
	CONSTRAINT `min` CHECK (`f1` + `f2` > 10),
	CONSTRAINT `t1_chk_1` CHECK (`f1` < 10),
	CONSTRAINT `t1_chk_2` CHECK (`f2` < 10)
) ENGINE = InnoDB DEFAULT CHARSET = utf8mb4
CREATE TABLE t2 LIKE t1;
# t2 will have check constraints with all generated names.
SHOW CREATE TABLE t2;
Table,Create Table
t2,CREATE TABLE `t2` (
	`f1` int DEFAULT NULL,
	`f2` int DEFAULT NULL,
	CONSTRAINT `max` CHECK (`f1` + `f2` < 929),
	CONSTRAINT `min` CHECK (`f1` + `f2` > 10),
	CONSTRAINT `t1_chk_1` CHECK (`f1` < 10),
	CONSTRAINT `t1_chk_2` CHECK (`f2` < 10)
) ENGINE = InnoDB DEFAULT CHARSET = utf8mb4
DROP TABLE t1;
DROP TABLE t2;
# Test cases to verify effect of check constraint in DML operations.
CREATE TABLE t1(f1 INT PRIMARY KEY, f2 INT CHECK (f2 < 10));
SHOW CREATE TABLE t1;
Table,Create Table
t1,CREATE TABLE `t1` (
	`f1` int NOT NULL,
	`f2` int DEFAULT NULL,
	PRIMARY KEY (`f1`),
	CONSTRAINT `t1_chk_1` CHECK (`f2` < 10)
) ENGINE = InnoDB DEFAULT CHARSET = utf8mb4
CREATE TABLE t2(f1 INT, f2 INT);
INSERT INTO t2 VALUES(101, 1);
INSERT INTO t2 VALUES(102, NULL);
INSERT INTO t2 VALUES(103, 1000);
# INSERT operations.
INSERT INTO t1 VALUES(1, 1);
INSERT INTO t1 VALUES(2, NULL);
#error ER_CHECK_CONSTRAINT_NOT_FOUND
## error_msg: $# ERR_EXECUTE_ON_MYSQL #$
INSERT INTO t1 VALUES(3, 1000);
ERR_EXECUTE_ON_MYSQL
INSERT IGNORE INTO t1 VALUES (3, 1000);
SELECT * FROM t1 ORDER BY f1;
f1,f2
1,1
2,null
#error ER_CHECK_CONSTRAINT_NOT_FOUND
## error_msg: $# ERR_EXECUTE_ON_MYSQL #$
INSERT INTO t1 SELECT * FROM t2;
ERR_EXECUTE_ON_MYSQL
SELECT * FROM t1 ORDER BY f1;
f1,f2
1,1
2,null
102,null
INSERT IGNORE INTO t1 SELECT * FROM t2;
SELECT * FROM t1 ORDER BY f1;
f1,f2
1,1
2,null
101,1
102,null
# REPLACE operations.
REPLACE INTO t1 VALUES(4, 1);
REPLACE INTO t1 VALUES(5, NULL);
#error ER_CHECK_CONSTRAINT_NOT_FOUND
## error_msg: $# ERR_EXECUTE_ON_MYSQL #$
REPLACE INTO t1 VALUES(6, 100);
ERR_EXECUTE_ON_MYSQL
#error ER_CHECK_CONSTRAINT_NOT_FOUND
## error_msg: $# ERR_EXECUTE_ON_MYSQL #$
REPLACE INTO t1 VALUES(2, 10);
ERR_EXECUTE_ON_MYSQL
REPLACE INTO t1 VALUES(2, 2);
SELECT * FROM t1 ORDER BY f1;
f1,f2
1,1
2,2
4,1
5,null
101,1
102,null
# UPDATE operations.
UPDATE t1 SET f2 = 2;
SELECT * FROM t1 ORDER BY f1;
f1,f2
1,2
2,2
4,2
5,2
101,2
102,2
UPDATE t1 SET f2 = NULL;
#error ER_CHECK_CONSTRAINT_NOT_FOUND
## error_msg: $# ERR_EXECUTE_ON_MYSQL #$
UPDATE t1 SET f2 = 1000;
ERR_EXECUTE_ON_MYSQL
SELECT * FROM t1 ORDER BY f1;
f1,f2
1,null
2,null
4,null
5,null
101,null
102,null
DROP TABLE t1;
DROP TABLE t2;
# Test case to verify check constraint with INSERT ON DUPLICATE
CREATE TABLE t1(f1 INT PRIMARY KEY, f2 INT CHECK (f2 < 10));
INSERT INTO t1 VALUES (1, 1);
INSERT INTO t1 VALUES (1, 2) ON DUPLICATE KEY UPDATE f2 = 4;
SELECT * FROM t1 ORDER BY f1;
f1,f2
1,4
INSERT IGNORE INTO t1 VALUES (1, 1) ON DUPLICATE KEY UPDATE f2 = 20;
#error ER_CHECK_CONSTRAINT_NOT_FOUND
## error_msg: $# ERR_EXECUTE_ON_MYSQL #$
INSERT INTO t1 VALUES (1, 1) ON DUPLICATE KEY UPDATE f2 = 20;
ERR_EXECUTE_ON_MYSQL
DROP TABLE t1;
# Test case to verify check constraints with multi-table update.
CREATE TABLE t1(f1 INT, f2 INT CHECK(f2 < 20));
INSERT INTO t1 VALUES (4, 4);
CREATE TABLE t2(f1 INT, f2 INT);
INSERT INTO t2 VALUES (4, 24);
#error ER_CHECK_CONSTRAINT_NOT_FOUND
 ## error_msg: $# ERR_EXECUTE_ON_MYSQL #$
UPDATE t1,t2  SET t1.f2 = t1.f2 + 20 WHERE t1.f1 = t2.f1;
ERR_EXECUTE_ON_MYSQL
DROP TABLE t1;
DROP TABLE t2;
CREATE TABLE t1 (
`f1` int(10) unsigned NOT NULL auto_increment,
`f2` int NOT NULL default '0',
PRIMARY KEY  (`f1`)
);
INSERT INTO t1 VALUES (4433,5424);
CREATE TABLE t2 (
`f3` int(10) unsigned NOT NULL default '0',
`f4` int(10) unsigned NOT NULL default '0' CHECK (f4 <= 500),
PRIMARY KEY  (`f3`,`f4`)
);
INSERT INTO t2 VALUES (495,500);
INSERT INTO t2 VALUES (496,500);
#error ER_CHECK_CONSTRAINT_NOT_FOUND
 ## error_msg: $# ERR_EXECUTE_ON_MYSQL #$
UPDATE t2,t1 set t2.f4 = t2.f4 + 1;
ERR_EXECUTE_ON_MYSQL
DROP TABLE t1;
DROP TABLE t2;
# Test cases to verify generated check constraint name updates due to
 # RENAME TABLE operation.
CREATE TABLE t1 (f1 INT CHECK(f1 < 10));
SHOW CREATE TABLE t1;
Table,Create Table
t1,CREATE TABLE `t1` (
	`f1` int DEFAULT NULL,
	CONSTRAINT `t1_chk_1` CHECK (`f1` < 10)
) ENGINE = InnoDB DEFAULT CHARSET = utf8mb4
RENAME TABLE t1 TO t2;
SHOW CREATE TABLE t2;
Table,Create Table
t2,CREATE TABLE `t2` (
	`f1` int DEFAULT NULL,
	CONSTRAINT `t1_chk_1` CHECK (`f1` < 10)
) ENGINE = InnoDB DEFAULT CHARSET = utf8mb4
CREATE TABLE t1(f1 INT CHECK (f1>10), f11 INT CHECK (f11 < 1000));
SHOW CREATE TABLE t1;
Table,Create Table
t1,CREATE TABLE `t1` (
	`f1` int DEFAULT NULL,
	`f11` int DEFAULT NULL,
	CONSTRAINT `t1_chk_1` CHECK (`f1` > 10),
	CONSTRAINT `t1_chk_2` CHECK (`f11` < 1000)
) ENGINE = InnoDB DEFAULT CHARSET = utf8mb4
RENAME TABLE t1 TO t3, t2 TO t1, t3 TO t2;
SHOW CREATE TABLE t1;
Table,Create Table
t1,CREATE TABLE `t1` (
	`f1` int DEFAULT NULL,
	CONSTRAINT `t1_chk_1` CHECK (`f1` < 10)
) ENGINE = InnoDB DEFAULT CHARSET = utf8mb4
SHOW CREATE TABLE t2;
Table,Create Table
t2,CREATE TABLE `t2` (
	`f1` int DEFAULT NULL,
	`f11` int DEFAULT NULL,
	CONSTRAINT `t1_chk_1` CHECK (`f1` > 10),
	CONSTRAINT `t1_chk_2` CHECK (`f11` < 1000)
) ENGINE = InnoDB DEFAULT CHARSET = utf8mb4
DROP TABLE t1;
DROP TABLE t2;
# Test case to verify check constraints creation with ALTER TABLE ADD
 # CONSTRAINT operation.
CREATE TABLE t1 (f1 INT CHECK (f1 < 10));
CREATE TABLE t3(f1 INT CHECK (f1 < 10));
ALTER TABLE t1 ADD CONSTRAINT CHECK (f1 > 1), ADD CONSTRAINT `t1_p_ck` CHECK (f1 > 1);
ALTER TABLE t3 ADD CONSTRAINT CHECK (f1 > 1), ADD CONSTRAINT `t3_p_ck` CHECK (f1 > 1);
SHOW CREATE TABLE t1;
Table,Create Table
t1,CREATE TABLE `t1` (
	`f1` int DEFAULT NULL,
	CONSTRAINT `t1_chk_1` CHECK (`f1` < 10),
	CONSTRAINT `t1_chk_2` CHECK (`f1` > 1),
	CONSTRAINT `t1_p_ck` CHECK (`f1` > 1)
) ENGINE = InnoDB DEFAULT CHARSET = utf8mb4
ALTER TABLE t1 ADD f2 INT CHECK (f2 < 10);
ALTER TABLE t1 ADD f3 INT CONSTRAINT `chk` CHECK (f3 < 10) NOT ENFORCED;
ALTER TABLE t3 ADD f2 INT CHECK (f2 < 10);
# Test case to verify check constraints creation with ALTER TABLE DROP
 # CONSTRAINT operation.
SHOW CREATE TABLE t3;
Table,Create Table
t3,CREATE TABLE `t3` (
	`f1` int DEFAULT NULL,
	`f2` int DEFAULT NULL,
	CONSTRAINT `t3_chk_1` CHECK (`f1` < 10),
	CONSTRAINT `t3_chk_2` CHECK (`f1` > 1),
	CONSTRAINT `t3_chk_3` CHECK (`f2` < 10),
	CONSTRAINT `t3_p_ck` CHECK (`f1` > 1)
) ENGINE = InnoDB DEFAULT CHARSET = utf8mb4
ALTER TABLE t3 DROP CONSTRAINT t3_chk_3;
SHOW CREATE TABLE t3;
Table,Create Table
t3,CREATE TABLE `t3` (
	`f1` int DEFAULT NULL,
	`f2` int DEFAULT NULL,
	CONSTRAINT `t3_chk_1` CHECK (`f1` < 10),
	CONSTRAINT `t3_chk_2` CHECK (`f1` > 1),
	CONSTRAINT `t3_p_ck` CHECK (`f1` > 1)
) ENGINE = InnoDB DEFAULT CHARSET = utf8mb4
ALTER TABLE t3 DROP CHECK t3_p_ck, ADD CONSTRAINT t3_p_ck CHECK (f1 > 38);
SHOW CREATE TABLE t3;
Table,Create Table
t3,CREATE TABLE `t3` (
	`f1` int DEFAULT NULL,
	`f2` int DEFAULT NULL,
	CONSTRAINT `t3_chk_1` CHECK (`f1` < 10),
	CONSTRAINT `t3_chk_2` CHECK (`f1` > 1),
	CONSTRAINT `t3_p_ck` CHECK (`f1` > 38)
) ENGINE = InnoDB DEFAULT CHARSET = utf8mb4
# Test case to verify check constraints alter operations.
INSERT INTO t1 VALUES (5, 5, 5);
ALTER TABLE t1 ALTER CHECK t1_chk_1 NOT ENFORCED, ALGORITHM=INPLACE;
INSERT INTO t1 VALUES (8, 8, 8);
#error ER_CHECK_CONSTRAINT_NOT_FOUND
## error_msg: $# ERR_SERVER #$
ALTER TABLE t1 ALTER CHECK t1_chk_1 ENFORCED, ALGORITHM=INPLACE;
ERR_SERVER
ALTER TABLE t1 ALTER CHECK t1_chk_1 ENFORCED, ALGORITHM=COPY;
ALTER TABLE t1 ALTER CHECK t1_chk_1 ENFORCED, ALGORITHM=INPLACE;
#error ER_CHECK_CONSTRAINT_NOT_FOUND
## error_msg: $# ERR_EXECUTE_ON_MYSQL #$
INSERT INTO t1 VALUES (12, 5, 5);
ERR_EXECUTE_ON_MYSQL
ALTER TABLE t1 ALTER CHECK t1_chk_1 NOT ENFORCED, ALGORITHM=INPLACE;
INSERT INTO t1 VALUES (12, 5, 5);
DROP TABLE t1;
DROP TABLE t3;
# Test case to alter table to add/drop column with the check constraint.
CREATE TABLE t1 (c1 INT, CONSTRAINT ck1 CHECK (c1 > 10));
ALTER TABLE t1 ADD COLUMN c2 INT,
ADD CONSTRAINT ck2 CHECK (c2 > 10);
SHOW CREATE TABLE t1;
Table,Create Table
t1,CREATE TABLE `t1` (
	`c1` int DEFAULT NULL,
	`c2` int DEFAULT NULL,
	CONSTRAINT `ck1` CHECK (`c1` > 10),
	CONSTRAINT `ck2` CHECK (`c2` > 10)
) ENGINE = InnoDB DEFAULT CHARSET = utf8mb4
#error ER_CHECK_CONSTRAINT_NOT_FOUND
 ## error_msg: $# ERR_EXECUTE_ON_MYSQL #$
INSERT INTO t1 VALUES(20,10);
ERR_EXECUTE_ON_MYSQL
ALTER TABLE t1 DROP CHECK ck2, DROP COLUMN c2;
ALTER TABLE t1 ADD COLUMN c3 INT,
ADD CONSTRAINT ck3 CHECK (c3 < 10);
ALTER TABLE t1 DROP CHECK ck3, DROP COLUMN c3,
ADD COLUMN c4 INT, ADD CONSTRAINT ck4 CHECK( c4 > 10);
SHOW CREATE TABLE t1;
Table,Create Table
t1,CREATE TABLE `t1` (
	`c1` int DEFAULT NULL,
	`c4` int DEFAULT NULL,
	CONSTRAINT `ck1` CHECK (`c1` > 10),
	CONSTRAINT `ck4` CHECK (`c4` > 10)
) ENGINE = InnoDB DEFAULT CHARSET = utf8mb4
DROP TABLE t1;
# Test case to verify alter statement with drop and alter constraint
 # on non-existing check constraint.
CREATE TABLE t1(c1 INT, c2 INT, c3 INT, c4 INT);
#error ER_CHECK_CONSTRAINT_NOT_FOUND
 ## error_msg: $# ERR_DROP_CHECK_CONSTRAINT #$
ALTER TABLE t1 DROP CHECK ck13;
ERR_DROP_CHECK_CONSTRAINT
#error ER_CHECK_CONSTRAINT_NOT_FOUND
 ## error_msg: $# ERR_ALTER_CHECK_CONSTRAINT #$
ALTER TABLE t1 ALTER CHECK ck13 ENFORCED;
ERR_ALTER_CHECK_CONSTRAINT
DROP TABLE t1;
# Test case to verify alter statement with multiple add, drop, enforce,
 # revoke check constraints.
CREATE TABLE t1(c1 INT, c2 INT, c3 INT, c4 INT);
ALTER TABLE t1 ADD CONSTRAINT ck11 CHECK(c1 > 1),
ADD CONSTRAINT ck12 CHECK(c1 < 1),
ADD CONSTRAINT ck21 CHECK(c2 > 1),
ADD CONSTRAINT ck22 CHECK(c2 < 1),
ADD CONSTRAINT ck31 CHECK(c3 > 1),
ADD CONSTRAINT ck32 CHECK(c3 < 1),
ADD CONSTRAINT ck41 CHECK(c4 > 1),
ADD CONSTRAINT ck42 CHECK(c4 < 1);
SHOW CREATE TABLE t1;
Table,Create Table
t1,CREATE TABLE `t1` (
	`c1` int DEFAULT NULL,
	`c2` int DEFAULT NULL,
	`c3` int DEFAULT NULL,
	`c4` int DEFAULT NULL,
	CONSTRAINT `ck11` CHECK (`c1` > 1),
	CONSTRAINT `ck12` CHECK (`c1` < 1),
	CONSTRAINT `ck21` CHECK (`c2` > 1),
	CONSTRAINT `ck22` CHECK (`c2` < 1),
	CONSTRAINT `ck31` CHECK (`c3` > 1),
	CONSTRAINT `ck32` CHECK (`c3` < 1),
	CONSTRAINT `ck41` CHECK (`c4` > 1),
	CONSTRAINT `ck42` CHECK (`c4` < 1)
) ENGINE = InnoDB DEFAULT CHARSET = utf8mb4
ALTER TABLE t1
DROP CHECK ck21, ADD CONSTRAINT ck21 CHECK (c1 > 10),
DROP CHECK ck22, ADD CONSTRAINT ck22 CHECK (c1 < 10),
DROP CHECK ck31, ADD CONSTRAINT ck31 CHECK (c1 > 10),
DROP CHECK ck32, ADD CONSTRAINT ck32 CHECK (c1 < 10),
DROP CHECK ck41, ADD CONSTRAINT ck41 CHECK (c1 > 10),
DROP CHECK ck42, ADD CONSTRAINT ck42 CHECK (c1 < 10),
ALTER CHECK ck11 NOT ENFORCED,
ALTER CHECK ck12 NOT ENFORCED,
ALTER CHECK ck11 ENFORCED;
DROP TABLE t1;
CREATE TABLE t1(c1 INT, c2 INT, c3 INT, c4 INT);
ALTER TABLE t1 ADD CONSTRAINT ck11 CHECK(c1 > 1),
ADD CONSTRAINT ck12 CHECK(c1 < 1),
ADD CONSTRAINT ck21 CHECK(c2 > 1),
ADD CONSTRAINT ck22 CHECK(c2 < 1),
ADD CONSTRAINT ck31 CHECK(c3 > 1),
ADD CONSTRAINT ck32 CHECK(c3 < 1),
ADD CONSTRAINT ck41 CHECK(c4 > 1),
ADD CONSTRAINT ck42 CHECK(c4 < 1);
SHOW CREATE TABLE t1;
Table,Create Table
t1,CREATE TABLE `t1` (
	`c1` int DEFAULT NULL,
	`c2` int DEFAULT NULL,
	`c3` int DEFAULT NULL,
	`c4` int DEFAULT NULL,
	CONSTRAINT `ck11` CHECK (`c1` > 1),
	CONSTRAINT `ck12` CHECK (`c1` < 1),
	CONSTRAINT `ck21` CHECK (`c2` > 1),
	CONSTRAINT `ck22` CHECK (`c2` < 1),
	CONSTRAINT `ck31` CHECK (`c3` > 1),
	CONSTRAINT `ck32` CHECK (`c3` < 1),
	CONSTRAINT `ck41` CHECK (`c4` > 1),
	CONSTRAINT `ck42` CHECK (`c4` < 1)
) ENGINE = InnoDB DEFAULT CHARSET = utf8mb4
ALTER TABLE t1
DROP CHECK ck21, ADD CONSTRAINT ck21 CHECK (c1 > 10),
DROP CHECK ck22, ADD CONSTRAINT ck22 CHECK (c1 < 10),
DROP CHECK ck31, ADD CONSTRAINT ck31 CHECK (c1 > 10),
DROP CHECK ck32, ADD CONSTRAINT ck32 CHECK (c1 < 10),
DROP CHECK ck41, ADD CONSTRAINT ck41 CHECK (c1 > 10),
DROP CHECK ck42, ADD CONSTRAINT ck42 CHECK (c1 < 10),
ALTER CHECK ck11 NOT ENFORCED,
ALTER CHECK ck12 NOT ENFORCED,
ALTER CHECK ck11 ENFORCED;
SHOW CREATE TABLE t1;
Table,Create Table
t1,CREATE TABLE `t1` (
	`c1` int DEFAULT NULL,
	`c2` int DEFAULT NULL,
	`c3` int DEFAULT NULL,
	`c4` int DEFAULT NULL,
	CONSTRAINT `ck11` CHECK (`c1` > 1),
	CONSTRAINT `ck12` CHECK (`c1` < 1) /*!80016 NOT ENFORCED */,
	CONSTRAINT `ck21` CHECK (`c1` > 10),
	CONSTRAINT `ck22` CHECK (`c1` < 10),
	CONSTRAINT `ck31` CHECK (`c1` > 10),
	CONSTRAINT `ck32` CHECK (`c1` < 10),
	CONSTRAINT `ck41` CHECK (`c1` > 10),
	CONSTRAINT `ck42` CHECK (`c1` < 10)
) ENGINE = InnoDB DEFAULT CHARSET = utf8mb4
DROP TABLE t1;
# Test case to verify auto-drop of check constraint on column drop.
CREATE TABLE t1 (f1 INT check (f1 < 10), f2 INT);
SHOW CREATE TABLE t1;
Table,Create Table
t1,CREATE TABLE `t1` (
	`f1` int DEFAULT NULL,
	`f2` int DEFAULT NULL,
	CONSTRAINT `t1_chk_1` CHECK (`f1` < 10)
) ENGINE = InnoDB DEFAULT CHARSET = utf8mb4
# Drops check constraint t1_chk_1 too.
ALTER TABLE t1 DROP COLUMN f1;
ALTER TABLE t1 ADD COLUMN f1 INT check(f1 < 10),
ADD CONSTRAINT check(f1 + f2 < 10),
ADD CONSTRAINT check(f2 < 10);
SHOW CREATE TABLE t1;
Table,Create Table
t1,CREATE TABLE `t1` (
	`f2` int DEFAULT NULL,
	`f1` int DEFAULT NULL,
	CONSTRAINT `t1_chk_2` CHECK (`f1` < 10),
	CONSTRAINT `t1_chk_3` CHECK (`f1` + `f2` < 10),
	CONSTRAINT `t1_chk_4` CHECK (`f2` < 10)
) ENGINE = InnoDB DEFAULT CHARSET = utf8mb4
#error ER_CHECK_CONSTRAINT_NOT_FOUND
 ## error_msg: $# ERR_SERVER #$
ALTER TABLE t1 DROP COLUMN f1;
ERR_SERVER
# Drops column f1 and constraints t1_chk_2, t1_chk_3.
ALTER TABLE t1 DROP CHECK t1_chk_2,DROP CHECK t1_chk_3, DROP COLUMN f1;
SHOW CREATE TABLE t1;
Table,Create Table
t1,CREATE TABLE `t1` (
	`f2` int DEFAULT NULL,
	CONSTRAINT `t1_chk_4` CHECK (`f2` < 10)
) ENGINE = InnoDB DEFAULT CHARSET = utf8mb4
ALTER TABLE t1 ADD COLUMN f1 INT check(f1 < 10), ADD COLUMN f3 INT check(f3 < 10);
DROP TABLE t1;
# Test case to verify check constraints with IN operator.
CREATE TABLE t1(f1 int CHECK (f1 IN (10, 20, 30)), f2 int, CHECK(f2 IN (100, 120, 450)));
SHOW CREATE TABLE t1;
Table,Create Table
t1,CREATE TABLE `t1` (
	`f1` int DEFAULT NULL,
	`f2` int DEFAULT NULL,
	CONSTRAINT `t1_chk_1` CHECK (`f1` IN (10, 20, 30)),
	CONSTRAINT `t1_chk_2` CHECK (`f2` IN (100, 120, 450))
) ENGINE = InnoDB DEFAULT CHARSET = utf8mb4
INSERT INTO t1 VALUES(10, 100);
#error ER_CHECK_CONSTRAINT_NOT_FOUND
## error_msg: $# ERR_EXECUTE_ON_MYSQL #$
INSERT INTO t1 VALUES(15, 100);
ERR_EXECUTE_ON_MYSQL
#error ER_CHECK_CONSTRAINT_NOT_FOUND
## error_msg: $# ERR_EXECUTE_ON_MYSQL #$
INSERT INTO t1 VALUES(10, 105);
ERR_EXECUTE_ON_MYSQL
DROP TABLE t1;
# Test case to verify check constraints with BETWEEN operator.
CREATE TABLE t1(f1 int CHECK(f1 BETWEEN 10 AND 30),
f2 int, CHECK(f2 BETWEEN 100 AND 450));
SHOW CREATE TABLE t1;
Table,Create Table
t1,CREATE TABLE `t1` (
	`f1` int DEFAULT NULL,
	`f2` int DEFAULT NULL,
	CONSTRAINT `t1_chk_1` CHECK (`f1` BETWEEN 10 AND 30),
	CONSTRAINT `t1_chk_2` CHECK (`f2` BETWEEN 100 AND 450)
) ENGINE = InnoDB DEFAULT CHARSET = utf8mb4
INSERT INTO t1 VALUES(20, 200);
#error ER_CHECK_CONSTRAINT_NOT_FOUND
## error_msg: $# ERR_EXECUTE_ON_MYSQL #$
INSERT INTO t1 VALUES(2, 200);
ERR_EXECUTE_ON_MYSQL
#error ER_CHECK_CONSTRAINT_NOT_FOUND
## error_msg: $# ERR_EXECUTE_ON_MYSQL #$
INSERT INTO t1 VALUES(20, 2000);
ERR_EXECUTE_ON_MYSQL
DROP TABLE t1;
# Test case to verify check constraints with IS NOT NULL.
CREATE TABLE t1 (f1 int CHECK(f1 IS NOT NULL));
SHOW CREATE TABLE t1;
Table,Create Table
t1,CREATE TABLE `t1` (
	`f1` int DEFAULT NULL,
	CONSTRAINT `t1_chk_1` CHECK (`f1` IS NOT NULL)
) ENGINE = InnoDB DEFAULT CHARSET = utf8mb4
INSERT INTO t1 VALUES(10);
#error ER_CHECK_CONSTRAINT_NOT_FOUND
## error_msg: $# ERR_EXECUTE_ON_MYSQL #$
INSERT INTO t1 VALUES(NULL);
ERR_EXECUTE_ON_MYSQL
DROP TABLE t1;
# Test case to verify check constraints with IS NULL.
CREATE TABLE t1 (f1 int CHECK(f1 IS NULL));
SHOW CREATE TABLE t1;
Table,Create Table
t1,CREATE TABLE `t1` (
	`f1` int DEFAULT NULL,
	CONSTRAINT `t1_chk_1` CHECK (`f1` IS NULL)
) ENGINE = InnoDB DEFAULT CHARSET = utf8mb4
INSERT INTO t1 VALUES(NULL);
#error ER_CHECK_CONSTRAINT_NOT_FOUND
## error_msg: $# ERR_EXECUTE_ON_MYSQL #$
INSERT INTO t1 VALUES(10);
ERR_EXECUTE_ON_MYSQL
DROP TABLE t1;
# Test case to verify check constraint with CASE Statement
CREATE TABLE t1(c1 INT, c2 INT);
ALTER TABLE t1 ADD CONSTRAINT CHECK( (CASE WHEN c1 > 10 THEN c2 = 20 END) = 1);
SHOW CREATE TABLE t1;
Table,Create Table
t1,CREATE TABLE `t1` (
	`c1` int DEFAULT NULL,
	`c2` int DEFAULT NULL,
	CONSTRAINT `t1_chk_1` CHECK (CASE
			WHEN `c1` > 10 THEN `c2` = 20
		END = 1)
) ENGINE = InnoDB DEFAULT CHARSET = utf8mb4
INSERT INTO t1 VALUES(1,1);
#error ER_CHECK_CONSTRAINT_NOT_FOUND
## error_msg: $# ERR_EXECUTE_ON_MYSQL #$
INSERT INTO t1 VALUES(15,1);
ERR_EXECUTE_ON_MYSQL
INSERT INTO t1 VALUES(15,20);
SELECT * FROM t1 ORDER BY c1;
c1,c2
1,1
15,20
DROP TABLE t1;
# CREATE WITH GSI
CREATE TABLE t1 (
  id int primary key,
  CHECK (c1 <> c2),
  c1 INT CHECK (c1 > 10),
  c2 INT CONSTRAINT c2_positive CHECK (c2 > 0),
  c3 INT CHECK (c3 < 100),
  CONSTRAINT c1_nonzero CHECK (c1 <> 0),
  CHECK (c1 > c3),
  index (`c1`)
);
SHOW CREATE TABLE t1;
Table,Create Table
t1,CREATE TABLE `t1` (
	`id` int NOT NULL,
	`c1` int DEFAULT NULL,
	`c2` int DEFAULT NULL,
	`c3` int DEFAULT NULL,
	PRIMARY KEY (`id`),
	CONSTRAINT `c1_nonzero` CHECK (`c1` <> 0),
	CONSTRAINT `c2_positive` CHECK (`c2` > 0),
	CONSTRAINT `t1_chk_1` CHECK (`c1` <> `c2`),
	CONSTRAINT `t1_chk_2` CHECK (`c1` > 10),
	CONSTRAINT `t1_chk_3` CHECK (`c3` < 100),
	CONSTRAINT `t1_chk_4` CHECK (`c1` > `c3`),
	INDEX `c1` (`c1`)
) ENGINE = InnoDB DEFAULT CHARSET = utf8mb4
DROP TABLE t1;